title,summary
Webb Maps Full Picture of How Phoenix Galaxy Cluster Forms Stars,"Discovery proves decades-old theory of galaxy feeding cycle. Since its discovery in 2010, the Phoenix cluster has always been one to stand out from the bunch. It's one of the most massive galaxy clusters known to astronomers, and was the first galaxy cluster found to have a supermassive black hole that promotes, instead of hinders, a high rate of star formation. Just how that was happening, though, remained a mystery. Researchers could see super-hot gas, and super-cold filaments of gas hiding forming stars. However, the in-between remained unseen. That is, until NASA's James Webb Space Telescope's infrared eye examined the cluster's core and found the missing cooling gas."
Webb Reveals Rapid-Fire Light Show From Milky Way's Central Black Hole,"Observations revealed ongoing fireworks featuring short bursts and longer flares. Imagine solar flares, but on a mind-boggling scale. A constant scintillation that is bright enough to shine across 26,000 light-years of space. And interspersed between the flickers, brilliant flashes that spew out on a daily basis. Researchers using NASA’s James Webb Space Telescope have spotted this activity in the center of our galaxy. The source is the accretion disk around the Milky Way’s central supermassive black hole. Webb detected brightness changes over remarkably short timescales, meaning they are coming from the black hole’s inner disk, not far beyond its event horizon."
NASA's Webb Exposes Complex Atmosphere of Starless Super-Jupiter,"Webb has captured evidence for patchy cloud layers, high-altitude hot spots, and variations in chemistry around a rapidly rotating, free-floating object 20 light-years from Earth. Getting a nice, good look at a planet outside our solar system can be tricky. Some exoplanets are way too cool and dim to observe. Many are virtually invisible in the blinding glare of their host stars. Others spin so slowly it would take days to survey the entire planet. This is where a stand-in like SIMP 0136 — a hot, bright, planet-sized object with a thick atmosphere, extremely fast rotation rate, and no star to spoil the view — comes in handy. Although SIMP 0136 is not technically an exoplanet because it doesn’t orbit a star, it’s close enough. Using NASA's James Webb Space Telescope to monitor SIMP 0136 directly as different parts of the object rotate into view, researchers have been able to disentangle the brightness patterns of hundreds of colors of infrared light coming from different parts of the object’s atmosphere. The results reveal variations in cloud cover, temperature, and chemistry that provide insight into the three-dimensional complexity of gas giants within and beyond our solar system."
NASA Webb Wows With Incredible Detail in Actively Forming Star System,"This near-infrared image shows the history of ejections from the two actively forming stars in Lynds 483. This scene is still transforming. What look like twin flames are known as Lynds 483 (L483), ejections from two actively forming stars at the center. The stars themselves are hidden in a teeny, opaque disk of dust that fits into one pixel. This is the most detailed image of L483 to date, delivered in high-resolution near-infrared light by the James Webb Space Telescope. For tens of thousands of years, the two central stars have been sending out column-like jets along with more “relaxed” outflows that willow, spread, and drape. As the ejections run into one another, new molecules form within the lobes. After roughly 1 million years have passed, the stars’ outbursts will end, with the stars fully formed. The iridescent regions of gas and dust will fade, and the scene will significantly clear."
NASA's Webb Peers Deeper into Mysterious Flame Nebula,"New population census answers the question: How small can you go when forming stars and brown dwarfs? The Flame Nebula, a star-forming region in the Orion Molecular Cloud Complex, has a long history of observation from telescopes such as NASA’s Hubble Space Telescope. However, the smallest stars within its dark and dusty heart have largely been hidden from view. The infrared vision from NASA’s James Webb Space Telescope has taken a first-time look, counting the smallest and faintest objects to determine the lowest mass required to form brown dwarfs."
"NASA's Webb Images Young, Giant Exoplanets, Detects Carbon Dioxide","Findings suggest giant exoplanets in HR 8799 system likely formed like Jupiter and Saturn. The first planet outside our solar system was discovered in the 1990’s, but it wasn’t until more than a decade later astronomers actually obtained a direct image of one. It’s extremely difficult to image an exoplanet, as stars in other planetary systems can be thousands of times brighter and bigger than their planets. NASA’s James Webb Space Telescope is equipped with a highly sensitive coronagraph, a tiny mask that blocks the light of the star, allowing Webb to image exoplanets. Webb’s new images of two iconic systems, HR 8799 and 51 Eridani, and their planets have stunned researchers, and provided additional information into the chemical make-up of the young gas giants."
NASA's Webb Telescope Unmasks True Nature of the Cosmic Tornado,"Webb’s exquisite details reveal a chance, random alignment of a protostellar outflow and a distant spiral galaxy. When peering out into space, we get a 2D view of a 3D universe. Sometimes, images will capture objects that appear close to each other on the sky, but are actually at wildly different distances and are unassociated with each other. NASA’s James Webb Space Telescope captured this beautiful juxtaposition of the nearby protostellar outflow known as Herbig-Haro 49/50 with a perfectly positioned, more distant spiral galaxy. Due to the close proximity of this Herbig-Haro object to the Earth, this new composite infrared image of the outflow from a young star allows researchers to examine details on small spatial scales like never before. With Webb, we can better understand how the jet activity associated with the formation of young stars can affect their surrounding environment."
NASA's Webb Captures Neptune's Auroras For First Time,"Long-sought auroral glow finally emerges under Webb’s powerful gaze. Neptune lies in the frigid, dark, vast frontier of the outer edges of our solar system about 3 billion miles away from the Sun. It’s only been visited once by a spacecraft back in 1989, and since then, observatories like NASA’s Hubble Space Telescope have tracked the planet’s changing weather. Hubble even discovered a new moon orbiting the planet in 2013. In many images, the planet appears as a blueish orb, sometimes with disappearing and reappearing dark spots. NASA’s James Webb Space Telescope has now revealed a different appearance—for the first time, a bright auroral glow from this ice giant."
NASA's Webb Sees Galaxy Mysteriously Clearing Fog of Early Universe,"Unexpected, bright hydrogen emission caught astronomers by surprise. The early universe was filled with a thick fog of neutral hydrogen. Even though the first stars and galaxies emitted copious amounts of ultraviolet light, that light struggled to pierce the fog. It took hundreds of millions of years for the neutral hydrogen to become ionized, electrons stripped from protons, allowing light to travel freely through space. Astronomers are seeking to understand this unique time of transformation, known as the era of reionization. A newly discovered galaxy illuminated this era in an unexpected way. JADES-GS-z13-1, observed just 330 million years after the big bang, shows bright hydrogen emission that should have been absorbed by the cosmic fog. Theorists are struggling to explain how its light could have pierced the fog at such an early time."
NASA Webb Explores Effect of Strong Magnetic Fields on Star Formation,"Two new research studies explore how a stellar nursery in the heart of the Milky Way is affected by the region’s strong magnetic fields. Despite decades of study, the process of star formation still holds many mysteries. Stars are the source of nearly all the universe’s chemical elements, including carbon and oxygen, so understanding why and how they form — or not — is a crucial initial step in understanding how the universe works and the origins of just about everything, including life on Earth. At the heart of our Milky Way galaxy is the star-forming region Sagittarius C, which despite a wealth of raw material does not make as many stars as astronomers would expect. Two new studies have used NASA’s James Webb Space Telescope to investigate star formation in this extreme environment that is relatively near the supermassive black hole at the core of the Milky Way, at 200 light-years distance."
NASA Webb's Autopsy of Planet Swallowed by Star Yields Surprise,"Lingering brightness provides evidence for how planet met its demise. Every year, scientists around the world apply for observing time on NASA’s James Webb Space Telescope. When proposals are selected after a vigorous vetting, the programs go into Webb’s observation queue for the future, ready to be scheduled based on various factors, including windows of visibility. However, what if an astronomer wants to study something, but they don’t know ahead of time exactly when that event will take place? Or where? Think supernova explosions or a gamma ray burst. This is called a Target of Opportunity (ToO) observation, which astronomers can define in the proposal planning phase, ready to have them ‘enacted’ when the time comes. One of the first ToO programs performed by Webb has now proven fruitful, providing insights into the immediate aftermath of when a star swallowed its own planet."
"With NASA's Webb, Dying Star's Energetic Display Comes Into Full Focus","Only the James Webb Space Telescope has the ability to fully detail this planetary nebula’s dusty rings with its unique mid-infrared camera. Come one, come all to witness the “magic” of a dying star’s dust sent across space! The James Webb Space Telescope has taken the most detailed image of planetary nebula NGC 1514 to date thanks to its unique mid-infrared observations. Webb’s image brings out the nebula’s nuances, particularly its “fuzzy” dusty rings. Also look for holes in the central pink region where material has broken through. Two central stars, which appear as one in Webb’s image, formed this scene over thousands of years — and will keep at it for thousands more."
NASA's Webb Lifts Veil on Common but Mysterious Type of Exoplanet,"Scientists determine atmospheric makeup of small, hot, gassy sub-Neptune. Much smaller than gas-giants and typically cooler than hot Jupiters, sub-Neptunes were extremely challenging to observe before the launch of NASA’s James Webb Space Telescope. Though they appear to be the most common type of exoplanet in our galaxy, you won’t find them in our solar system. Astronomers are trying to understand how these planets formed and evolved, why they are so common, and why they don’t orbit our Sun. Adding to the mystery, many sub-Neptunes appear to be very highly obscured by clouds and hazes, which have made it impossible to determine their atmospheric makeup. Now, by using Webb to study the hot sub-Neptune TOI-421 b, scientists have uncovered the chemical fingerprints of its atmosphere. Did this exoplanet form and evolve differently from the cooler, sub-Neptunes observed previously? Do TOI-421 b’s differences indicate a new classification of hot sub-Neptunes, or is it just that exoplanets are very diverse? By using Webb, researchers hope to find out."
New Visualization From NASA's Webb Telescope Explores Cosmic Cliffs,"Iconic Webb image transforms into a 3D landscape of gas, dust, and stars. Powerful observatories like the Hubble and James Webb Space Telescopes have captured hundreds of vivid images of the cosmos. Yet even the most stunning images are a 2D representation of a 3D universe. It becomes difficult to get a sense of the true scale and structure of what we’re seeing. By combining real data with scientific expertise and a dash of artistic license, a visualization team from NASA’s Universe of Learning has transformed one of Webb’s first images, the Cosmic Cliffs, into a 3D panorama. Viewers are invited to journey through this realm of dusty peaks and valleys."
"NASA's Webb Reveals New Details, Mysteries in Jupiter's Aurora","Webb sees the aurora flickering, fluctuating, and undulating at Jupiter’s north pole. Earth’s auroras, also known as the Northern and Southern Lights, appear as shimmering curtains visible to observers on the ground and even astronauts aboard the International Space Station. Auroras occur when energetic particles from the Sun are funneled by our magnetic field and slam into the atmosphere near Earth’s poles. The planet Jupiter experiences auroras on a much grander scale – both larger and hundreds of times brighter than Earth’s. Astronomers turned Webb’s keen gaze to Jupiter and found that its auroras “pop” and “fizz,” changing on timescales of minutes or even seconds."
Webb's Titan Forecast: Partly Cloudy With Occasional Methane Showers,"Astronomers see evidence of clouds bubbling up over Titan’s northern hemisphere. Saturn’s moon Titan is the only solar system moon with a substantial atmosphere. It also contains a soup of carbon-containing molecules, making it an intriguing target for astrobiological studies despite its frigid temperature of about -290 degrees Fahrenheit (-180 degrees Celsius). Astronomers have used both probes like Cassini/Huygens and ground-based telescopes like the W.M. Keck Observatories to monitor weather on Titan. Now, a team has combined data from NASA’s James Webb Space Telescope and the Keck II telescope to see evidence of cloud convection in Titan’s northern hemisphere for the first time. Most of Titan’s lakes and seas are located in that hemisphere, and are likely replenished by an occasional rain of methane and ethane."
Another First: NASA Webb Identifies Frozen Water in Young Star System,"Researchers found water ice throughout a dusty debris disk circling the Sun-like star HD 181327. We know water in its solid state — ice — exists on moons orbiting Jupiter, Saturn, Uranus, and Neptune. Telescopes have also spotted frozen water on dwarf planets, comets, and other bits of rock that “hang out” in the Kuiper Belt at the edge of our solar system. But for decades, water ice was not confirmed to exist around other stars. The James Webb Space Telescope has unequivocally changed that: Data from its NIRSpec (Near-Infrared Spectrograph) confirmed the presence of water ice in a dusty debris disk that surrounds a star known as HD 181327. Water ice heavily influences the formation of giant planets and may also be delivered by comets to fully formed rocky planets. Now that researchers have detected water ice with Webb, they have opened the door to studying how these processes play out in new ways — in many other planetary systems — for all researchers."
NASA's Webb Rounds Out Picture of Sombrero Galaxy’s Disk,"Stellar light shines from iconic target in near-infrared The Sombrero galaxy has long had a place in astronomical history as an intriguing object. The first written record of this galaxy was noted in 1781, almost 250 years ago, by Pierre Méchain, a French astronomer and surveyor. Méchain was a longtime collaborator of Charles Messier, of the Messier catalog fame. While the Sombrero galaxy didn’t earn an official place in the Messier catalog until 1921 (as Messier 104), since it’s easily visible from the Northern Hemisphere with a backyard telescope or even binoculars, it remained top of mind for observers over the years. Now, new observations from the world’s premiere space observatory have added to the history of this storied galaxy."
Frigid Exoplanet in Strange Orbit Imaged by NASA's Webb,"First image ever taken of exoplanet in extremely mis-aligned system NASA’s James Webb Space Telescope has not only become known for groundbreaking science discoveries across all fields of astrophysics, but also for its gorgeous, intricate images of celestial objects like star-forming regions and solar system planets. Webb’s images of exoplanets look noticeably different than those sweeping landscapes, though. This is because it is extremely difficult to image planets orbiting stars other than our own Sun. Oftentimes the host stars are thousands of times brighter than the planets that orbit them, and the planets are relatively close to their stars on the sky. However, researchers can obtain an abundance of information from what appears as just a distant dot in an image. Webb’s new image of 14 Herculis c, a cold exoplanet orbiting a star 60 light-years away from Earth, has given researchers insight into the planet’s temperature, strange orbit, and atmospheric dynamics."
Likely Saturn-Mass Planet Imaged by NASA Webb Is Lightest Ever Seen,"The newfound planet represents Webb’s first direct image discovery of a planet. Almost 6,000 exoplanets have been discovered to date. NASA’s James Webb Space Telescope has just added another likely planet to that list: a Saturn-mass planet named TWA 7 b. Astronomers found it by blocking the light of its host star to reveal the hidden planet. It’s located in a gap in one of three dust rings that were discovered around the star TWA 7 by previous ground-based observations. The object’s brightness, color, distance from the star, and position within the ring are consistent with theoretical predictions for a planet that is expected to be sculpting the surrounding debris disk."
NASA's Webb Digs into Structural Origins of Disk Galaxies,"Scientists “excavated” disk galaxies across cosmic time to understand their formation history. Disk galaxies, like our own Milky Way galaxy, commonly consist of both a thick and thin disk of stars — each with different features, including stellar population and movement. Three major theoretical scenarios have been proposed to explain the formation mechanisms and timing of thick and thin disks. A team of astronomers has recently investigated the structure of disk galaxies by sifting through multiple surveys from NASA’s James Webb Space Telescope. This extensive sample includes over 100 edge-on disk galaxies up to roughly 11 billion years ago. The team’s analysis aligns with one of the three scenarios, suggesting that thick stellar disk formation occurs first, and thin stellar disk formation follows. When this happens in a galaxy’s formation history depends on the galaxy’s mass."
"NASA Webb 'Pierces' Bullet Cluster, Refines Its Mass","Webb shows fainter and more distant galaxies, along with light from stars that trace dark matter in these galaxy clusters, helping researchers carefully map everything in the scene. It’s rare for galaxy clusters to collide and merge at high speeds. An iconic example is the Bullet Cluster, the aftermath of two vast galaxy clusters that collided. To be able to “replay” what happened, and in which order, researchers need to first fully define all the contents in this scene. NASA’s James Webb Space Telescope has provided some of the best information to date: Highly precise, extremely detailed near-infrared images of a significant portion of the Bullet Cluster. Its new observations allowed researchers to fine tune their maps of its mass, including an invisible substance known as dark matter that does not emit, reflect, or absorb light."
